{
  "schema_version": 1,
  "profile": "nighthall.duplex/1",
  "name": "workbench",
  "types": {
    "User": {
      "kind": "record",
      "fields": [
        {
          "name": "id",
          "type": "string",
          "go_name": "ID"
        },
        {
          "name": "email",
          "type": "string"
        },
        {
          "name": "name",
          "type": "string"
        }
      ]
    },
    "Project": {
      "kind": "record",
      "fields": [
        {
          "name": "id",
          "type": "string",
          "go_name": "ID"
        },
        {
          "name": "owner_id",
          "type": "string",
          "go_name": "OwnerID"
        },
        {
          "name": "version",
          "type": "integer"
        },
        {
          "name": "key",
          "type": "string"
        },
        {
          "name": "name",
          "type": "string"
        },
        {
          "name": "description",
          "type": "string"
        },
        {
          "name": "created_at",
          "type": "timestamp",
          "go_name": "CreatedAt"
        },
        {
          "name": "updated_at",
          "type": "timestamp",
          "go_name": "UpdatedAt"
        }
      ]
    },
    "Criterion": {
      "kind": "record",
      "fields": [
        {
          "name": "id",
          "type": "string",
          "go_name": "ID"
        },
        {
          "name": "description",
          "type": "string"
        }
      ]
    },
    "SpecificationDraft": {
      "kind": "record",
      "fields": [
        {
          "name": "objective",
          "type": "string"
        },
        {
          "name": "criteria",
          "type": {
            "array": "Criterion"
          }
        },
        {
          "name": "constraints",
          "type": {
            "array": "string"
          }
        },
        {
          "name": "dependencies",
          "type": {
            "array": "string"
          }
        }
      ]
    },
    "Specification": {
      "kind": "record",
      "fields": [
        {
          "name": "id",
          "type": "string",
          "go_name": "ID"
        },
        {
          "name": "revision",
          "type": "integer"
        },
        {
          "name": "published_at",
          "type": "timestamp",
          "go_name": "PublishedAt"
        }
      ],
      "extends": [
        "SpecificationDraft"
      ]
    },
    "Step": {
      "kind": "record",
      "fields": [
        {
          "name": "id",
          "type": "string",
          "go_name": "ID"
        },
        {
          "name": "objective",
          "type": "string"
        },
        {
          "name": "state",
          "type": "string"
        },
        {
          "name": "result_note",
          "type": "string",
          "go_name": "ResultNote"
        },
        {
          "name": "change_reason",
          "type": "string",
          "go_name": "ChangeReason"
        }
      ]
    },
    "WorkItem": {
      "kind": "record",
      "fields": [
        {
          "name": "id",
          "type": "string",
          "go_name": "ID"
        },
        {
          "name": "project_id",
          "type": "string",
          "go_name": "ProjectID"
        },
        {
          "name": "key",
          "type": "string"
        },
        {
          "name": "title",
          "type": "string"
        },
        {
          "name": "state",
          "type": "string"
        },
        {
          "name": "version",
          "type": "integer"
        },
        {
          "name": "draft",
          "type": "SpecificationDraft",
          "go_name": "Draft",
          "nullable": true
        },
        {
          "name": "specifications",
          "type": {
            "array": "Specification"
          }
        },
        {
          "name": "current_specification_id",
          "type": "string",
          "go_name": "CurrentSpecificationID"
        },
        {
          "name": "plan_specification_id",
          "type": "string",
          "go_name": "PlanSpecificationID"
        },
        {
          "name": "steps",
          "type": {
            "array": "Step"
          }
        },
        {
          "name": "dependencies",
          "type": {
            "array": "string"
          }
        },
        {
          "name": "readiness",
          "type": "string"
        },
        {
          "name": "created_at",
          "type": "timestamp",
          "go_name": "CreatedAt"
        },
        {
          "name": "updated_at",
          "type": "timestamp",
          "go_name": "UpdatedAt"
        }
      ]
    },
    "Event": {
      "kind": "record",
      "fields": [
        {
          "name": "sequence",
          "type": "integer"
        },
        {
          "name": "type",
          "type": "string"
        },
        {
          "name": "project_id",
          "type": "string",
          "go_name": "ProjectID"
        },
        {
          "name": "work_item_id",
          "type": "string",
          "go_name": "WorkItemID"
        },
        {
          "name": "actor_id",
          "type": "string",
          "go_name": "ActorID"
        },
        {
          "name": "data",
          "type": "json"
        },
        {
          "name": "created_at",
          "type": "timestamp",
          "go_name": "CreatedAt"
        }
      ]
    },
    "ListProjectsParams": {
      "kind": "record",
      "fields": []
    },
    "CreateProjectParams": {
      "kind": "record",
      "fields": [
        {
          "name": "key",
          "type": "string"
        },
        {
          "name": "name",
          "type": "string"
        },
        {
          "name": "description",
          "type": "string"
        }
      ]
    },
    "UpdateProjectParams": {
      "kind": "record",
      "fields": [
        {
          "name": "id",
          "type": "string",
          "go_name": "ID"
        },
        {
          "name": "expected_version",
          "type": "integer",
          "go_name": "ExpectedVersion",
          "required": false
        },
        {
          "name": "key",
          "type": "string",
          "required": false
        },
        {
          "name": "name",
          "type": "string",
          "required": false
        },
        {
          "name": "description",
          "type": "string",
          "required": false
        }
      ]
    },
    "ListWorkItemsParams": {
      "kind": "record",
      "fields": [
        {
          "name": "project",
          "type": "string",
          "required": false
        },
        {
          "name": "state",
          "type": "string",
          "required": false
        }
      ]
    },
    "GetWorkItemParams": {
      "kind": "record",
      "fields": [
        {
          "name": "id",
          "type": "string",
          "go_name": "ID"
        }
      ]
    },
    "CreateWorkItemParams": {
      "kind": "record",
      "fields": [
        {
          "name": "project",
          "type": "string"
        },
        {
          "name": "title",
          "type": "string"
        },
        {
          "name": "draft",
          "type": "SpecificationDraft",
          "required": false
        }
      ]
    },
    "UpdateWorkItemParams": {
      "kind": "record",
      "fields": [
        {
          "name": "id",
          "type": "string",
          "go_name": "ID"
        },
        {
          "name": "expected_version",
          "type": "integer",
          "go_name": "ExpectedVersion",
          "required": false
        },
        {
          "name": "title",
          "type": "string",
          "required": false
        },
        {
          "name": "draft",
          "type": "SpecificationDraft",
          "required": false
        }
      ]
    },
    "PublishSpecificationParams": {
      "kind": "record",
      "fields": [
        {
          "name": "id",
          "type": "string",
          "go_name": "ID"
        },
        {
          "name": "expected_version",
          "type": "integer",
          "go_name": "ExpectedVersion",
          "required": false
        }
      ]
    },
    "CancelWorkItemParams": {
      "kind": "record",
      "fields": [
        {
          "name": "id",
          "type": "string",
          "go_name": "ID"
        },
        {
          "name": "expected_version",
          "type": "integer",
          "go_name": "ExpectedVersion",
          "required": false
        },
        {
          "name": "reason",
          "type": "string"
        }
      ]
    },
    "ReopenWorkItemParams": {
      "kind": "record",
      "fields": [
        {
          "name": "id",
          "type": "string",
          "go_name": "ID"
        },
        {
          "name": "expected_version",
          "type": "integer",
          "go_name": "ExpectedVersion",
          "required": false
        },
        {
          "name": "reason",
          "type": "string"
        }
      ]
    },
    "SetDependenciesParams": {
      "kind": "record",
      "fields": [
        {
          "name": "id",
          "type": "string",
          "go_name": "ID"
        },
        {
          "name": "expected_version",
          "type": "integer",
          "go_name": "ExpectedVersion",
          "required": false
        },
        {
          "name": "dependencies",
          "type": {
            "array": "string"
          }
        }
      ]
    },
    "SetStepsParams": {
      "kind": "record",
      "fields": [
        {
          "name": "id",
          "type": "string",
          "go_name": "ID"
        },
        {
          "name": "expected_version",
          "type": "integer",
          "go_name": "ExpectedVersion",
          "required": false
        },
        {
          "name": "steps",
          "type": {
            "array": "Step"
          }
        },
        {
          "name": "reason",
          "type": "string",